{
  "schemaVersion": 1,
  "id": "run-2026-08-13T22-01-38-888Z-c2b8e5df",
  "createdAt": "2026-08-13T22:01:38.890Z",
  "status": "complete",
  "source": "recorded",
  "strategy": "sequential-interleaved",
  "executionStrategy": "sequential-interleaved",
  "system": {
    "architecture": "arm64",
    "os": "macOS",
    "osVersion": "26.5.2",
    "kernelRelease": "25.5.0",
    "translated": false,
    "model": "MacBook Pro",
    "modelIdentifier": "Mac17,2",
    "chip": "Apple M5",
    "cores": "10 (4 Super and 6 Efficiency)",
    "memoryBytes": 17179869184,
    "collectedAt": "2026-08-13T22:01:10.596Z"
  },
  "input": {
    "id": "jfk",
    "path": "samples/jfk.wav",
    "sha256": "59dfb9a4acb36fe2a2affc14bacbee2920ff435cb13cc314a08c13f66ba7860e",
    "durationMs": 11000,
    "referenceTranscript": "And so my fellow Americans ask not what your country can do for you. Ask what you can do for your country."
  },
  "methodology": {
    "measuredRuns": 5,
    "warmupRuns": 1,
    "threads": 4,
    "order": "alternating AB/BA",
    "clock": "whisper.cpp monotonic internal timing plus macOS /usr/bin/time",
    "commandSemantics": {
      "language": "English-only small.en model; whisper.cpp default language detection",
      "gpu": "disabled at build with GGML_METAL=OFF; CPU backend only",
      "decoder": "whisper.cpp defaults (beam size 5, best-of 5)",
      "note": "Per-run command arrays preserve the exact historical process arguments; the current harness uses the same command shape."
    }
  },
  "profiles": [
    {
      "id": "reference",
      "label": "FP16 Reference",
      "precision": "F16",
      "threads": 4,
      "backend": "whisper.cpp CPU",
      "model": {
        "id": "Whisper small.en",
        "bytes": 487614201,
        "sha256": "c6138d6d58ecc8322097e0f987c32f1be8bb0a18532a3f88f734d1bbf9c41e5d",
        "precision": "F16",
        "format": "ggml"
      },
      "runtime": {
        "path": "vendor/stt-runner/build-reference/bin/whisper-cli",
        "file": "vendor/stt-runner/build-reference/bin/whisper-cli: Mach-O 64-bit executable arm64",
        "lipo": "Non-fat file: vendor/stt-runner/build-reference/bin/whisper-cli is architecture: arm64",
        "sha256": "49b810861aba0e1c479f830ec4cf0c8c1388fcffc30e595efc659969f28341f7"
      },
      "interventions": [
        "Native arm64",
        "CPU",
        "FP16 model representation"
      ]
    },
    {
      "id": "optimized",
      "label": "Q4 Optimized",
      "precision": "Q4_0",
      "threads": 4,
      "backend": "whisper.cpp CPU",
      "model": {
        "id": "Whisper small.en",
        "bytes": 145471353,
        "sha256": "37eb5db9875dae4fdf9b2727459ccbf2ee8ba9ef5590655bb13a7b573aae241b",
        "precision": "Q4_0",
        "format": "ggml"
      },
      "runtime": {
        "path": "vendor/stt-runner/build-reference/bin/whisper-cli",
        "file": "vendor/stt-runner/build-reference/bin/whisper-cli: Mach-O 64-bit executable arm64",
        "lipo": "Non-fat file: vendor/stt-runner/build-reference/bin/whisper-cli is architecture: arm64",
        "sha256": "49b810861aba0e1c479f830ec4cf0c8c1388fcffc30e595efc659969f28341f7"
      },
      "interventions": [
        "Native arm64",
        "CPU",
        "Q4_0 weight quantization"
      ]
    }
  ],
  "measurements": [
    {
      "profileId": "reference",
      "phase": "warmup",
      "sequence": 1,
      "startedAt": "2026-08-13T22:01:11.078Z",
      "command": [
        "/usr/bin/time",
        "-lp",
        "vendor/stt-runner/build-reference/bin/whisper-cli",
        "-m",
        "models/ggml-small.en.bin",
        "-f",
        "samples/jfk.wav",
        "-t",
        "4",
        "-nt"
      ],
      "timing": {
        "inferenceMs": 3371.82,
        "totalMs": 3390,
        "modelLoadMs": 235.25,
        "encodeMs": 2641.09,
        "decodeMs": 0
      },
      "memory": {
        "peakRssBytes": 762724352,
        "peakFootprintBytes": 787432528
      },
      "transcript": {
        "text": "And so, my fellow Americans, ask not what your country can do for you. Ask what you can do for your country."
      },
      "quality": {
        "wer": 0,
        "normalizedWer": 0
      }
    },
    {
      "profileId": "optimized",
      "phase": "warmup",
      "sequence": 2,
      "startedAt": "2026-08-13T22:01:14.481Z",
      "command": [
        "/usr/bin/time",
        "-lp",
        "vendor/stt-runner/build-reference/bin/whisper-cli",
        "-m",
        "models/ggml-small.en-q4_0.bin",
        "-f",
        "samples/jfk.wav",
        "-t",
        "4",
        "-nt"
      ],
      "timing": {
        "inferenceMs": 2369.83,
        "totalMs": 2380,
        "modelLoadMs": 142.98,
        "encodeMs": 1936.05,
        "decodeMs": 0
      },
      "memory": {
        "peakRssBytes": 370982912,
        "peakFootprintBytes": 441254752
      },
      "transcript": {
        "text": "And so, my fellow Americans, ask not what your country can do for you. Ask what you can do for your country."
      },
      "quality": {
        "wer": 0,
        "normalizedWer": 0
      }
    },
    {
      "profileId": "reference",
      "phase": "measured",
      "sequence": 3,
      "startedAt": "2026-08-13T22:01:16.870Z",
      "command": [
        "/usr/bin/time",
        "-lp",
        "vendor/stt-runner/build-reference/bin/whisper-cli",
        "-m",
        "models/ggml-small.en.bin",
        "-f",
        "samples/jfk.wav",
        "-t",
        "4",
        "-nt"
      ],
      "timing": {
        "inferenceMs": 2562.69,
        "totalMs": 2580,
        "modelLoadMs": 141.5,
        "encodeMs": 2019.82,
        "decodeMs": 0
      },
      "memory": {
        "peakRssBytes": 765509632,
        "peakFootprintBytes": 787366992
      },
      "transcript": {
        "text": "And so, my fellow Americans, ask not what your country can do for you. Ask what you can do for your country."
      },
      "quality": {
        "wer": 0,
        "normalizedWer": 0
      }
    },
    {
      "profileId": "optimized",
      "phase": "measured",
      "sequence": 4,
      "startedAt": "2026-08-13T22:01:19.452Z",
      "command": [
        "/usr/bin/time",
        "-lp",
        "vendor/stt-runner/build-reference/bin/whisper-cli",
        "-m",
        "models/ggml-small.en-q4_0.bin",
        "-f",
        "samples/jfk.wav",
        "-t",
        "4",
        "-nt"
      ],
      "timing": {
        "inferenceMs": 1491.86,
        "totalMs": 1500,
        "modelLoadMs": 52.36,
        "encodeMs": 1211.32,
        "decodeMs": 0
      },
      "memory": {
        "peakRssBytes": 444219392,
        "peakFootprintBytes": 439059272
      },
      "transcript": {
        "text": "And so, my fellow Americans, ask not what your country can do for you. Ask what you can do for your country."
      },
      "quality": {
        "wer": 0,
        "normalizedWer": 0
      }
    },
    {
      "profileId": "optimized",
      "phase": "measured",
      "sequence": 5,
      "startedAt": "2026-08-13T22:01:20.957Z",
      "command": [
        "/usr/bin/time",
        "-lp",
        "vendor/stt-runner/build-reference/bin/whisper-cli",
        "-m",
        "models/ggml-small.en-q4_0.bin",
        "-f",
        "samples/jfk.wav",
        "-t",
        "4",
        "-nt"
      ],
      "timing": {
        "inferenceMs": 1486.35,
        "totalMs": 1490,
        "modelLoadMs": 49.29,
        "encodeMs": 1214.74,
        "decodeMs": 0
      },
      "memory": {
        "peakRssBytes": 444301312,
        "peakFootprintBytes": 439124784
      },
      "transcript": {
        "text": "And so, my fellow Americans, ask not what your country can do for you. Ask what you can do for your country."
      },
      "quality": {
        "wer": 0,
        "normalizedWer": 0
      }
    },
    {
      "profileId": "reference",
      "phase": "measured",
      "sequence": 6,
      "startedAt": "2026-08-13T22:01:22.456Z",
      "command": [
        "/usr/bin/time",
        "-lp",
        "vendor/stt-runner/build-reference/bin/whisper-cli",
        "-m",
        "models/ggml-small.en.bin",
        "-f",
        "samples/jfk.wav",
        "-t",
        "4",
        "-nt"
      ],
      "timing": {
        "inferenceMs": 2673,
        "totalMs": 2690,
        "modelLoadMs": 113.71,
        "encodeMs": 2091.3,
        "decodeMs": 0
      },
      "memory": {
        "peakRssBytes": 792150016,
        "peakFootprintBytes": 787317840
      },
      "transcript": {
        "text": "And so, my fellow Americans, ask not what your country can do for you. Ask what you can do for your country."
      },
      "quality": {
        "wer": 0,
        "normalizedWer": 0
      }
    },
    {
      "profileId": "reference",
      "phase": "measured",
      "sequence": 7,
      "startedAt": "2026-08-13T22:01:25.155Z",
      "command": [
        "/usr/bin/time",
        "-lp",
        "vendor/stt-runner/build-reference/bin/whisper-cli",
        "-m",
        "models/ggml-small.en.bin",
        "-f",
        "samples/jfk.wav",
        "-t",
        "4",
        "-nt"
      ],
      "timing": {
        "inferenceMs": 3353.81,
        "totalMs": 3370,
        "modelLoadMs": 133.9,
        "encodeMs": 2752.49,
        "decodeMs": 0
      },
      "memory": {
        "peakRssBytes": 748126208,
        "peakFootprintBytes": 787137568
      },
      "transcript": {
        "text": "And so, my fellow Americans, ask not what your country can do for you. Ask what you can do for your country."
      },
      "quality": {
        "wer": 0,
        "normalizedWer": 0
      }
    },
    {
      "profileId": "optimized",
      "phase": "measured",
      "sequence": 8,
      "startedAt": "2026-08-13T22:01:28.527Z",
      "command": [
        "/usr/bin/time",
        "-lp",
        "vendor/stt-runner/build-reference/bin/whisper-cli",
        "-m",
        "models/ggml-small.en-q4_0.bin",
        "-f",
        "samples/jfk.wav",
        "-t",
        "4",
        "-nt"